{
  "name": "swarm-factory--cc",
  "project": "swarm-factory",
  "milestone": "01-new-concepts",
  "milestone_path": "D:\\sources\\_unowned\\swarm-factory\\milestones\\01-new-concepts",
  "scaffold": null,
  "harness": "claude-code",
  "location": "D:\\sources\\_unowned\\swarm-factory\\worktrees\\01-new-concepts",
  "params": {
    "max_iterations": null,
    "max_turns": 50,
    "model": null
  },
  "created_at": "2026-02-09T00:00:00Z"
}
