{
  "name": "coletivos_completion--cc",
  "project": "coletivos",
  "milestone": "completion",
  "milestone_path": null,
  "scaffold": null,
  "harness": "claude-code",
  "location": "D:\\sources\\_unowned\\coletivos.app",
  "params": {
    "max_iterations": null,
    "max_turns": 50,
    "model": null
  },
  "created_at": "2026-02-08T00:00:00Z"
}
