{
  "name": "agiliza_01-very-first-agentic-worker--cc",
  "project": "agiliza",
  "milestone": "01-very-first-agentic-worker",
  "milestone_path": "milestones/01-very-first-agentic-worker",
  "scaffold": null,
  "harness": "claude-code",
  "location": "D:\\sources\\codr.studio\\agiliza",
  "params": {
    "max_iterations": null,
    "max_turns": 50,
    "model": null
  },
  "created_at": "2026-02-08T00:00:00Z"
}
