{
  "name": "agiliza--cc",
  "project": "agiliza",
  "milestone": "07-autopilot-on",
  "milestone_path": "milestones/07-autopilot-on",
  "scaffold": null,
  "harness": "claude-code",
  "location": "D:\\sources\\codr.studio\\agiliza",
  "params": {
    "max_iterations": null,
    "max_turns": null,
    "model": null
  },
  "created_at": "2026-02-09T00:00:00.000Z"
}
